{"$id":"urn:mcpaudit:evidence-conservation:OracleAdjudicationV1","$schema":"https://json-schema.org/draft/2020-12/schema","additionalProperties":false,"properties":{"admission_status":{"enum":["CANDIDATE","ADMITTED","REJECTED"]},"body":{"additionalProperties":false,"properties":{"adjudicator":{"type":["object","null"]},"agreement":{"additionalProperties":false,"properties":{"initial_disagreements":{"items":{"type":"object"},"type":"array"},"initial_value":{"type":["number","null"]},"method":{"const":"COHENS_KAPPA"}},"required":["method","initial_value","initial_disagreements"],"type":"object"},"blindness_attestations":{"items":{"additionalProperties":false,"properties":{"reviewer_id":{"minLength":1,"type":"string"},"status":{"const":"PENDING_INDEPENDENT_REVIEW"}},"required":["reviewer_id","status"],"type":"object"},"maxItems":2,"minItems":2,"type":"array"},"consumer_outputs_seen":{"const":false},"entries":{"items":{"additionalProperties":false,"properties":{"accepted_reason_families":{"items":{"minLength":1,"type":"string"},"minItems":1,"type":"array"},"authority_ceiling":{"additionalProperties":false,"properties":{"authority":{"enum":["BLOCKED","NONAUTHORITATIVE","CONDITIONAL","STRONG"]},"disposition":{"enum":["VALID","PARTIAL","MISSING","STALE","MASKED","CONTRADICTORY","UNSUPPORTED","MISBOUND"]}},"required":["authority","disposition"],"type":"object"},"case_id":{"pattern":"^P[123]-(?:C|0[1-6])$","type":"string"},"claim_critical":{"type":"boolean"},"contract_refs":{"items":{"minLength":1,"type":"string"},"minItems":1,"type":"array"},"control_case_id":{"pattern":"^P[123]-C$","type":"string"},"disposition":{"enum":["VALID","PARTIAL","MISSING","STALE","MASKED","CONTRADICTORY","UNSUPPORTED","MISBOUND"]},"evidence_relation":{"enum":["CONTROL","STRICTLY_BELOW_CONTROL"]},"evidence_vector":{"items":{"enum":[0,1]},"maxItems":6,"minItems":6,"type":"array"},"path_id":{"enum":["P1","P2","P3"]},"rationale":{"minLength":1,"type":"string"}},"required":["case_id","path_id","control_case_id","evidence_vector","evidence_relation","authority_ceiling","disposition","accepted_reason_families","claim_critical","rationale","contract_refs"],"type":"object"},"maxItems":21,"minItems":21,"type":"array"},"final_agreement_count":{"maximum":21,"minimum":0,"type":"integer"},"freeze_receipt_ids":{"items":{"minLength":1,"type":"string"},"maxItems":3,"minItems":3,"type":"array"},"oracle_id":{"minLength":1,"type":"string"},"oracle_sha256":{"pattern":"^[0-9a-f]{64}$","type":"string"},"reviewers":{"items":{"additionalProperties":false,"properties":{"reviewer_id":{"minLength":1,"type":"string"},"status":{"const":"PENDING_INDEPENDENT_REVIEW"}},"required":["reviewer_id","status"],"type":"object"},"maxItems":2,"minItems":2,"type":"array"},"sealed_at_utc":{"type":["string","null"]}},"required":["oracle_id","freeze_receipt_ids","entries","reviewers","blindness_attestations","agreement","adjudicator","final_agreement_count","consumer_outputs_seen","sealed_at_utc","oracle_sha256"],"type":"object"},"content_sha256":{"pattern":"^[0-9a-f]{64}$","type":"string"},"created_at_utc":{"minLength":1,"type":"string"},"producer":{"additionalProperties":false,"properties":{"actor_id":{"minLength":1,"type":"string"},"role":{"minLength":1,"type":"string"}},"required":["actor_id","role"],"type":"object"},"record_id":{"minLength":1,"type":"string"},"reviews":{"items":{"additionalProperties":false,"properties":{"decision":{"enum":["ADMIT","REJECT"]},"independent_from":{"items":{"minLength":1,"type":"string"},"type":"array"},"rationale":{"minLength":1,"type":"string"},"reviewed_at_utc":{"minLength":1,"type":"string"},"reviewed_content_sha256":{"pattern":"^[0-9a-f]{64}$","type":"string"},"reviewer_id":{"minLength":1,"type":"string"}},"required":["reviewer_id","independent_from","decision","reviewed_at_utc","reviewed_content_sha256","rationale"],"type":"object"},"type":"array"},"schema":{"const":"OracleAdjudicationV1"},"spec_sha256":{"pattern":"^[0-9a-f]{64}$","type":"string"},"supersedes":{"type":["string","null"]}},"required":["schema","record_id","spec_sha256","created_at_utc","producer","supersedes","body","content_sha256","reviews","admission_status"],"type":"object"}
