{"admission_status":"CANDIDATE","body":{"adjudicator":null,"agreement":{"initial_disagreements":[],"initial_value":null,"method":"COHENS_KAPPA"},"blindness_attestations":[{"reviewer_id":"reviewer-slot-1","status":"PENDING_INDEPENDENT_REVIEW"},{"reviewer_id":"reviewer-slot-2","status":"PENDING_INDEPENDENT_REVIEW"}],"consumer_outputs_seen":false,"entries":[{"accepted_reason_families":["valid"],"authority_ceiling":{"authority":"STRONG","disposition":"VALID"},"case_id":"P1-C","claim_critical":false,"contract_refs":["paths/p1.json","spec/evidence-conservation-v1.md"],"control_case_id":"P1-C","disposition":"VALID","evidence_relation":"CONTROL","evidence_vector":[1,1,1,1,1,1],"path_id":"P1","rationale":"Candidate transcription of the approved control relation; independent adjudication pending."},{"accepted_reason_families":["missing"],"authority_ceiling":{"authority":"NONAUTHORITATIVE","disposition":"MISSING"},"case_id":"P1-01","claim_critical":true,"contract_refs":["paths/p1.json","spec/evidence-conservation-v1.md"],"control_case_id":"P1-C","disposition":"MISSING","evidence_relation":"STRICTLY_BELOW_CONTROL","evidence_vector":[0,1,1,1,1,1],"path_id":"P1","rationale":"Candidate transcription of the approved missing relation; independent adjudication pending."},{"accepted_reason_families":["stale"],"authority_ceiling":{"authority":"NONAUTHORITATIVE","disposition":"STALE"},"case_id":"P1-02","claim_critical":true,"contract_refs":["paths/p1.json","spec/evidence-conservation-v1.md"],"control_case_id":"P1-C","disposition":"STALE","evidence_relation":"STRICTLY_BELOW_CONTROL","evidence_vector":[1,0,1,1,1,1],"path_id":"P1","rationale":"Candidate transcription of the approved stale relation; independent adjudication pending."},{"accepted_reason_families":["masked"],"authority_ceiling":{"authority":"NONAUTHORITATIVE","disposition":"MASKED"},"case_id":"P1-03","claim_critical":true,"contract_refs":["paths/p1.json","spec/evidence-conservation-v1.md"],"control_case_id":"P1-C","disposition":"MASKED","evidence_relation":"STRICTLY_BELOW_CONTROL","evidence_vector":[1,1,0,1,1,1],"path_id":"P1","rationale":"Candidate transcription of the approved masked relation; independent adjudication pending."},{"accepted_reason_families":["contradictory"],"authority_ceiling":{"authority":"NONAUTHORITATIVE","disposition":"CONTRADICTORY"},"case_id":"P1-04","claim_critical":true,"contract_refs":["paths/p1.json","spec/evidence-conservation-v1.md"],"control_case_id":"P1-C","disposition":"CONTRADICTORY","evidence_relation":"STRICTLY_BELOW_CONTROL","evidence_vector":[1,1,1,0,1,1],"path_id":"P1","rationale":"Candidate transcription of the approved contradictory relation; independent adjudication pending."},{"accepted_reason_families":["unsupported"],"authority_ceiling":{"authority":"NONAUTHORITATIVE","disposition":"UNSUPPORTED"},"case_id":"P1-05","claim_critical":true,"contract_refs":["paths/p1.json","spec/evidence-conservation-v1.md"],"control_case_id":"P1-C","disposition":"UNSUPPORTED","evidence_relation":"STRICTLY_BELOW_CONTROL","evidence_vector":[1,1,1,1,0,1],"path_id":"P1","rationale":"Candidate transcription of the approved unsupported relation; independent adjudication pending."},{"accepted_reason_families":["misbound"],"authority_ceiling":{"authority":"NONAUTHORITATIVE","disposition":"MISBOUND"},"case_id":"P1-06","claim_critical":true,"contract_refs":["paths/p1.json","spec/evidence-conservation-v1.md"],"control_case_id":"P1-C","disposition":"MISBOUND","evidence_relation":"STRICTLY_BELOW_CONTROL","evidence_vector":[1,1,1,1,1,0],"path_id":"P1","rationale":"Candidate transcription of the approved misbound relation; independent adjudication pending."},{"accepted_reason_families":["valid"],"authority_ceiling":{"authority":"STRONG","disposition":"VALID"},"case_id":"P2-C","claim_critical":false,"contract_refs":["paths/p2.json","spec/evidence-conservation-v1.md"],"control_case_id":"P2-C","disposition":"VALID","evidence_relation":"CONTROL","evidence_vector":[1,1,1,1,1,1],"path_id":"P2","rationale":"Candidate transcription of the approved control relation; independent adjudication pending."},{"accepted_reason_families":["missing"],"authority_ceiling":{"authority":"NONAUTHORITATIVE","disposition":"MISSING"},"case_id":"P2-01","claim_critical":true,"contract_refs":["paths/p2.json","spec/evidence-conservation-v1.md"],"control_case_id":"P2-C","disposition":"MISSING","evidence_relation":"STRICTLY_BELOW_CONTROL","evidence_vector":[0,1,1,1,1,1],"path_id":"P2","rationale":"Candidate transcription of the approved missing relation; independent adjudication pending."},{"accepted_reason_families":["stale"],"authority_ceiling":{"authority":"NONAUTHORITATIVE","disposition":"STALE"},"case_id":"P2-02","claim_critical":true,"contract_refs":["paths/p2.json","spec/evidence-conservation-v1.md"],"control_case_id":"P2-C","disposition":"STALE","evidence_relation":"STRICTLY_BELOW_CONTROL","evidence_vector":[1,0,1,1,1,1],"path_id":"P2","rationale":"Candidate transcription of the approved stale relation; independent adjudication pending."},{"accepted_reason_families":["masked"],"authority_ceiling":{"authority":"NONAUTHORITATIVE","disposition":"MASKED"},"case_id":"P2-03","claim_critical":true,"contract_refs":["paths/p2.json","spec/evidence-conservation-v1.md"],"control_case_id":"P2-C","disposition":"MASKED","evidence_relation":"STRICTLY_BELOW_CONTROL","evidence_vector":[1,1,0,1,1,1],"path_id":"P2","rationale":"Candidate transcription of the approved masked relation; independent adjudication pending."},{"accepted_reason_families":["contradictory"],"authority_ceiling":{"authority":"BLOCKED","disposition":"CONTRADICTORY"},"case_id":"P2-04","claim_critical":true,"contract_refs":["paths/p2.json","spec/evidence-conservation-v1.md"],"control_case_id":"P2-C","disposition":"CONTRADICTORY","evidence_relation":"STRICTLY_BELOW_CONTROL","evidence_vector":[1,1,1,0,1,1],"path_id":"P2","rationale":"Candidate transcription of the approved contradictory relation; independent adjudication pending."},{"accepted_reason_families":["unsupported"],"authority_ceiling":{"authority":"BLOCKED","disposition":"UNSUPPORTED"},"case_id":"P2-05","claim_critical":true,"contract_refs":["paths/p2.json","spec/evidence-conservation-v1.md"],"control_case_id":"P2-C","disposition":"UNSUPPORTED","evidence_relation":"STRICTLY_BELOW_CONTROL","evidence_vector":[1,1,1,1,0,1],"path_id":"P2","rationale":"Candidate transcription of the approved unsupported relation; independent adjudication pending."},{"accepted_reason_families":["misbound"],"authority_ceiling":{"authority":"BLOCKED","disposition":"MISBOUND"},"case_id":"P2-06","claim_critical":true,"contract_refs":["paths/p2.json","spec/evidence-conservation-v1.md"],"control_case_id":"P2-C","disposition":"MISBOUND","evidence_relation":"STRICTLY_BELOW_CONTROL","evidence_vector":[1,1,1,1,1,0],"path_id":"P2","rationale":"Candidate transcription of the approved misbound relation; independent adjudication pending."},{"accepted_reason_families":["valid"],"authority_ceiling":{"authority":"STRONG","disposition":"VALID"},"case_id":"P3-C","claim_critical":false,"contract_refs":["paths/p3.json","spec/evidence-conservation-v1.md"],"control_case_id":"P3-C","disposition":"VALID","evidence_relation":"CONTROL","evidence_vector":[1,1,1,1,1,1],"path_id":"P3","rationale":"Candidate transcription of the approved control relation; independent adjudication pending."},{"accepted_reason_families":["missing"],"authority_ceiling":{"authority":"NONAUTHORITATIVE","disposition":"MISSING"},"case_id":"P3-01","claim_critical":true,"contract_refs":["paths/p3.json","spec/evidence-conservation-v1.md"],"control_case_id":"P3-C","disposition":"MISSING","evidence_relation":"STRICTLY_BELOW_CONTROL","evidence_vector":[0,1,1,1,1,1],"path_id":"P3","rationale":"Candidate transcription of the approved missing relation; independent adjudication pending."},{"accepted_reason_families":["stale"],"authority_ceiling":{"authority":"NONAUTHORITATIVE","disposition":"STALE"},"case_id":"P3-02","claim_critical":true,"contract_refs":["paths/p3.json","spec/evidence-conservation-v1.md"],"control_case_id":"P3-C","disposition":"STALE","evidence_relation":"STRICTLY_BELOW_CONTROL","evidence_vector":[1,0,1,1,1,1],"path_id":"P3","rationale":"Candidate transcription of the approved stale relation; independent adjudication pending."},{"accepted_reason_families":["masked"],"authority_ceiling":{"authority":"BLOCKED","disposition":"MASKED"},"case_id":"P3-03","claim_critical":true,"contract_refs":["paths/p3.json","spec/evidence-conservation-v1.md"],"control_case_id":"P3-C","disposition":"MASKED","evidence_relation":"STRICTLY_BELOW_CONTROL","evidence_vector":[1,1,0,1,1,1],"path_id":"P3","rationale":"Candidate transcription of the approved masked relation; independent adjudication pending."},{"accepted_reason_families":["contradictory"],"authority_ceiling":{"authority":"BLOCKED","disposition":"CONTRADICTORY"},"case_id":"P3-04","claim_critical":true,"contract_refs":["paths/p3.json","spec/evidence-conservation-v1.md"],"control_case_id":"P3-C","disposition":"CONTRADICTORY","evidence_relation":"STRICTLY_BELOW_CONTROL","evidence_vector":[1,1,1,0,1,1],"path_id":"P3","rationale":"Candidate transcription of the approved contradictory relation; independent adjudication pending."},{"accepted_reason_families":["unsupported"],"authority_ceiling":{"authority":"BLOCKED","disposition":"UNSUPPORTED"},"case_id":"P3-05","claim_critical":true,"contract_refs":["paths/p3.json","spec/evidence-conservation-v1.md"],"control_case_id":"P3-C","disposition":"UNSUPPORTED","evidence_relation":"STRICTLY_BELOW_CONTROL","evidence_vector":[1,1,1,1,0,1],"path_id":"P3","rationale":"Candidate transcription of the approved unsupported relation; independent adjudication pending."},{"accepted_reason_families":["misbound"],"authority_ceiling":{"authority":"NONAUTHORITATIVE","disposition":"MISBOUND"},"case_id":"P3-06","claim_critical":true,"contract_refs":["paths/p3.json","spec/evidence-conservatio